{
  "$schema": "http://json-schema.org/draft-07/schema#",
  "title": "Article",
  "description": "Single article. Claude's scheduled task writes one of these per story per day to data/articles/<YYYY-MM-DD>/<slug>.json. The build script renders each into web/posts/<YYYY-MM-DD>/<slug>.html.",
  "type": "object",
  "required": ["slug", "title", "category", "meta_description", "tldr", "body_markdown", "published_at"],
  "properties": {
    "slug": { "type": "string", "description": "URL-safe slug, lowercase, hyphens. Becomes the filename and URL." },
    "title": { "type": "string", "description": "H1 title, <= 65 characters when possible. Includes the primary keyword." },
    "category": { "type": "string", "enum": [
      "AI Models", "AI / ML Research",
      "Programming", "Framework & Library Releases",
      "Developer Tools", "Cloud & Infrastructure",
      "Startups", "Open Source", "Cybersecurity", "Gadgets", "Industry News"
    ]},
    "tags": { "type": "array", "items": { "type": "string" }, "minItems": 3, "maxItems": 8 },
    "meta_description": { "type": "string", "minLength": 110, "maxLength": 170 },
    "tldr": { "type": "string", "description": "2-3 sentence summary at the top of the article." },
    "body_markdown": { "type": "string", "description": "Full article body in Markdown. Use H2 and H3 headings. Do NOT include the H1 (the title field is the H1)." },
    "faq": {
      "type": "array",
      "minItems": 3,
      "items": {
        "type": "object",
        "required": ["question", "answer"],
        "properties": { "question": { "type": "string" }, "answer": { "type": "string" } }
      }
    },
    "sources": {
      "type": "array",
      "minItems": 1,
      "items": {
        "type": "object",
        "required": ["label", "url"],
        "properties": { "label": { "type": "string" }, "url": { "type": "string", "format": "uri" } }
      }
    },
    "image_suggestions": {
      "type": "array",
      "items": {
        "type": "object",
        "properties": {
          "placement": { "type": "string" },
          "description": { "type": "string" },
          "alt_text": { "type": "string" }
        }
      }
    },
    "thumbnail": {
      "type": "object",
      "description": "Gradient colors for the card thumbnail.",
      "properties": { "c1": { "type": "string" }, "c2": { "type": "string" } }
    },
    "published_at": { "type": "string", "format": "date-time" },
    "reading_time_min": { "type": "integer", "minimum": 1 },
    "importance_score": { "type": "integer", "minimum": 1, "maximum": 10, "description": "Highest-scored article becomes the featured story of the day." },
    "og_image": { "type": "string", "description": "Optional OG image URL. Defaults to /assets/img/og-default.svg." }
  }
}
